Family Illness,Managing responsibilities due to a sick family member.,Balancing work and caregiving for my ill family member is overwhelming.,Taking care of a family member who is ill while fulfilling job responsibilities.,"Feeling: anxiety, overwhelm, stress","Leading to: increased absenteeism, decreased productivity, lowered morale","Creates perception of being: distracted, unreliable, underperforming",Life,"family matters, caregiver stress, health and well-being","flexible schedules, emotional support, stress management"
Hostile Environment,Dealing with a toxic and distressing work atmosphere.,The negativity at work makes me anxious and unhappy.,"Experiencing a hostile and distressing environment at work, affecting mental health and job satisfaction.","Feeling: distress, anxiety, unhappiness","Leading to: higher turnover rates, decreased productivity, increased conflict","Creates perception of being: defensive, disengaged, unmotivated",Social & communication,"workplace culture issues, high stress levels, anxiety","awareness training, mental health support, clear communication"
Information Access,Difficulties in obtaining necessary information for work.,It's frustrating when I can't access the information I need quickly.,Struggling to obtain or access essential information needed to perform job tasks efficiently.,"Feeling: frustration, confusion, stress","Leading to: inefficient processes, missed deadlines, decreased productivity","Creates perception of being: inefficient, disengaged, unproductive",Technology,"digital barriers, information management issues, decreased productivity","organisational tools, efficient workspace, cognitive support"
Remote Server Access,Challenges in connecting to remote servers for work.,"I often face issues accessing remote servers, which delays my work.","Experiencing difficulties in connecting to and accessing remote servers, leading to delays and disruptions in workflow.","Feeling: frustration, stress, nervousness","Leading to: missed deadlines, decreased productivity, increased operational costs","Creates perception of being: unreliable, inefficient, distracted",Technology,"remote work challenges, technology adaptation challenges, task execution errors","reliable VPNs, technical support, workflow automation"
Healthcare Advocacy,Advocating for a sick family member within the healthcare system.,Navigating the healthcare system for my family member is exhausting.,"Acting as an advocate for a sick family member, dealing with complex healthcare procedures and communication with professionals.","Feeling: exhaustion, frustration, helplessness","Leading to: increased absenteeism, decreased productivity, lowered morale","Creates perception of being: distracted, stressed, unreliable",Life,"caregiver stress, health and well-being, emotional distress","flexible schedules, support networks, mental health support"
Addison's Disease,Managing the symptoms and treatment of Addison's Disease at work.,Coping with Addison's Disease affects my daily performance.,"Dealing with the chronic condition of Addison's Disease, including managing symptoms and treatment while maintaining work.","Feeling: exhaustion, anxiety, stress","Leading to: increased absenteeism, decreased productivity, higher turnover rates","Creates perception of being: inconsistent, unreliable, underperforming","Physical, Mental & emotional","chronic illness, fatigue, health and well-being","flexible schedules, wellness programs, medical accommodation"
Legal & Financial Matters,Addressing legal and financial issues related to a family member's illness.,Handling the legal and financial aspects of my family member's illness is overwhelming.,"Managing complex legal and financial responsibilities related to a family member's illness, impacting focus and work performance.","Feeling: overwhelm, anxiety, stress","Leading to: increased absenteeism, decreased productivity, higher turnover rates","Creates perception of being: distracted, unreliable, stressed",Life,"caregiver stress, financial strain, legal concerns","flexible schedules, legal assistance, financial planning"
ADHD Management,Dealing with symptoms of ADHD in a professional setting.,My ADHD makes it hard to stay focused and organised at work.,"Managing the symptoms of ADHD, such as inattention and hyperactivity, affecting task execution and organisation at work.","Feeling: frustration, inadequacy, stress","Leading to: decreased productivity, missed deadlines, increased errors","Creates perception of being: unfocused, disorganised, unreliable","Mental & emotional, Sensory & focus","ADHD, attention issues, task management difficulties","cognitive support, task management, organisational tools"
New Home Adjustment,"Adapting to a new home, neighbourhood, or commute.",Adjusting to my new living situation is disrupting my routine.,"Settling into a new home or neighbourhood, or adjusting to a new commute, affecting daily routines and work-life balance.","Feeling: overwhelm, stress, apprehension","Leading to: decreased productivity, increased absenteeism, lowered morale","Creates perception of being: distracted, inconsistent, underperforming",Life,"relocation stress, life changes, work-life balance issues","flexible schedules, stress management, support networks"
Return to Work Adjustment,Readjusting to work after a prolonged break.,Returning to work after a break is challenging and stressful.,Readjusting to the workplace environment and job responsibilities after an extended period away from work.,"Feeling: anxiety, stress, inadequacy","Leading to: decreased productivity, increased errors, lower employee engagement","Creates perception of being: inconsistent, underperforming, unmotivated","Mental & emotional, Social & communication","performance issues, high stress levels, anxiety","mentorship programs, professional development, stress management"
Confidence & Motivation,"Loss of confidence, motivation, and job satisfaction, leading to absenteeism.",My lack of confidence and motivation is affecting my job performance.,"Experiencing a decline in confidence and motivation, resulting in decreased job satisfaction and potential absenteeism.","Feeling: inadequacy, unhappiness, stress","Leading to: increased absenteeism, decreased productivity, lowered morale","Creates perception of being: unmotivated, disengaged, underperforming","Mental & emotional, Social & communication","performance issues, decreased productivity, mental health","professional counselling, mentorship programs, emotional support"
Aging,Coping with age-related changes at work.,My age makes it harder to keep up with work.,"Aging can lead to reduced physical stamina, slower cognitive processes, and difficulties adapting to new technologies.","Feeling: inadequacy, isolation, stress","Leading to: decreased productivity, higher turnover rates, reduced employee retention","Creates perception of being: slow, inefficient, outdated","Physical, Mental & emotional","health and well-being, performance issues, fatigue, underemployment","flexible schedules, wellness programs, mentorship programs"
Air Quality/Irritants,Dealing with poor air quality and irritants in the workplace.,Poor air quality makes it hard to focus.,"Exposure to pollutants or irritants can lead to respiratory issues, headaches, and decreased concentration.","Feeling: agitation, stress, discomfort","Leading to: increased absenteeism, decreased productivity, higher operational costs","Creates perception of being: distracted, unproductive, disengaged","Physical, Sensory & focus","environmental and ergonomic issues, health and well-being, discomfort at work","environmental modifications, air purification, ergonomic adjustments"
Albinism,Managing the effects of albinism in a professional setting.,My albinism affects my work experience.,"Albinism can cause visual impairments and sensitivity to light, impacting the ability to perform certain tasks.","Feeling: isolation, frustration, inadequacy","Leading to: decreased productivity, increased errors, reduced competitive advantage","Creates perception of being: inefficient, unreliable, distracted","Physical, Sensory & focus","accessibility, visual discomfort, sensory challenges, discrimination","assistive technology, accessibility and inclusion, visual planning"
Alcoholism,Struggling with alcoholism while maintaining job performance.,Alcoholism disrupts my professional life.,"Alcoholism can lead to absenteeism, decreased productivity, and strained workplace relationships.","Feeling: shame, anxiety, hopelessness","Leading to: increased absenteeism, reduced employee retention, higher legal risks","Creates perception of being: unreliable, unprofessional, inconsistent","Mental & emotional, Social","mental health, substance abuse, performance issues, workplace conflicts","mental health support, professional counselling, support networks"
Allergies,Navigating severe allergies at work.,Allergies make my workday uncomfortable.,"Severe allergies can lead to frequent sneezing, itching, and other symptoms, disrupting focus and productivity.","Feeling: discomfort, stress, frustration","Leading to: decreased productivity, increased absenteeism, higher operational costs","Creates perception of being: distracted, inefficient, inconsistent","Physical, Sensory & focus","health and well-being, environmental and ergonomic issues, sensory challenges","air purification, environmental modifications, flexible schedules"
Allowing Harassment,Enduring workplace harassment that causes distress.,Harassment at work makes me feel unsafe.,"Persistent harassment can lead to significant emotional distress, reduced morale, and fear of retaliation.","Feeling: fear, anxiety, hopelessness","Leading to: increased absenteeism, higher turnover rates, decreased morale","Creates perception of being: detached, withdrawn, distrustful","Mental & emotional, Social","emotional distress, workplace conflicts, discrimination, high stress levels","equal opportunity, harassment training, emotional support"
Alzheimer's Disease,Managing work with Alzheimer's disease.,Alzheimer's affects my memory and tasks.,"Alzheimer's disease impacts memory, cognitive functions, and the ability to perform daily work tasks.","Feeling: confusion, frustration, hopelessness","Leading to: increased errors, decreased productivity, missed deadlines","Creates perception of being: forgetful, unreliable, inefficient","Mental & emotional, Physical","memory challenges, cognitive challenges, performance issues, high stress levels","cognitive support, memory training, flexible schedules"
Hand Amputation,Adapting to work after a hand amputation.,My amputation affects my job performance.,"Hand amputation requires adaptation to new methods for tasks, possibly using prosthetics or other aids.","Feeling: inadequacy, frustration, stress","Leading to: increased errors, reduced productivity, higher operational costs","Creates perception of being: inefficient, unreliable, overwhelmed","Physical, Technology","accessibility, accommodation, physical barriers, performance issues","assistive technology, adaptive strategies, ergonomic adjustments"
ALS (Lou Gehrig's Disease),Coping with ALS symptoms while working.,ALS makes it hard to continue working.,"ALS causes progressive muscle weakness, impacting mobility, communication, and overall work ability.","Feeling: helplessness, stress, hopelessness","Leading to: increased absenteeism, higher turnover rates, decreased productivity","Creates perception of being: unreliable, inconsistent, withdrawn","Physical, Mental & emotional","chronic illness, mobility challenges, performance issues, high stress levels","assistive technology, flexible schedules, emotional support"
Anxiety,Managing anxiety in a professional environment.,Anxiety makes it difficult to work well.,"Anxiety can lead to nervousness, trouble concentrating, and avoidance of social interactions at work.","Feeling: nervousness, stress, apprehension","Leading to: decreased productivity, poor communication, increased absenteeism","Creates perception of being: distracted, unapproachable, erratic","Mental & emotional, Social","mental health, communication anxiety, performance anxiety, high stress levels","stress management, mental health support, clear communication"
Clarification Needs,Difficulty needing clarification and negotiation with employers.,I often need to clarify tasks and negotiate with my boss.,Struggling to understand and negotiate tasks with employers.,"Feeling: anxiety, confusion, apprehension","Leading to: decreased productivity, increased errors, poor communication","Creates perception of being: distracted, inconsistent, unreliable","Mental & emotional, Social & communication","anxiety, communication barriers, performance issues, task management difficulties","clear communication, daily planning, task management, stress management"
Mental Health Impact,Anxiety or mental health issues affecting work.,My mental health issues make it hard to focus at work.,Anxiety and other mental health issues disrupt work performance.,"Feeling: stress, anxiety, insecurity","Leading to: decreased productivity, increased absenteeism, lower employee engagement","Creates perception of being: disengaged, unreliable, distracted",Mental & emotional,"anxiety, mental health, performance issues, stress","mental health support, flexible schedules, wellness programs, stress management"
Psychological Disorders,"Anxiety, depression, PTSD, or other psychological disorders.",My psychological disorders affect my work life severely.,Psychological disorders impacting performance and interactions.,"Feeling: anxiety, depression, hopelessness","Leading to: increased absenteeism, lowered morale, decreased productivity","Creates perception of being: withdrawn, unreliable, moody",Mental & emotional,"anxiety, depression, PTSD, mental health","mental health support, professional counselling, support networks, wellness programs"
Workplace Conflict,"Anxiety, discomfort, mistrust, conflict, morale issues.",Workplace conflicts make me anxious and uneasy.,Conflicts and mistrust affecting workplace atmosphere and morale.,"Feeling: anxiety, discomfort, mistrust","Leading to: increased conflict, lowered morale, decreased collaboration","Creates perception of being: defensive, irritable, unapproachable",Social & communication,"anxiety, workplace conflicts, morale issues, mistrust","conflict resolution, clear communication, stress management, team-building"
Medical Appointments Stress,Stress and potential burnout from managing medical appointments and work.,Juggling medical appointments with work is overwhelming.,Managing medical appointments alongside work causing stress.,"Feeling: stress, overwhelm, exhaustion","Leading to: increased absenteeism, missed deadlines, lower productivity","Creates perception of being: unreliable, overwhelmed, disengaged","Mental & emotional, Life","stress, burnout, medical appointments, work-life balance","flexible schedules, support networks, wellness programs, time management"
Job Satisfaction Stress,"Stress, anxiety, demoralisation, decreased morale and job satisfaction.","I'm stressed and demoralised, impacting my job satisfaction.",Decreased morale and job satisfaction due to stress and anxiety.,"Feeling: stress, demoralisation, unhappiness","Leading to: lower morale, decreased productivity, higher turnover rates","Creates perception of being: demotivated, negative, disengaged",Mental & emotional,"stress, anxiety, job satisfaction, morale issues","stress management, professional counselling, wellness programs, support networks"
Feeling Undervalued,"Anxiety, uncertainty, feeling vulnerable or undervalued.",I feel vulnerable and undervalued at work.,Anxiety and uncertainty leading to feelings of being undervalued.,"Feeling: anxiety, uncertainty, insecurity","Leading to: decreased motivation, lower employee engagement, higher turnover rates","Creates perception of being: insecure, apprehensive, unapproachable","Mental & emotional, Social & communication","anxiety, insecurity, job satisfaction, employee engagement","clear communication, emotional support, mentorship programs, recognition"
Mood and Motivation Impact,"Anxiety, uncertainty, overwhelm impacting mood, motivation, and well-being.","I feel overwhelmed, affecting my mood and motivation.",Anxiety and uncertainty leading to overwhelm and affecting mood.,"Feeling: overwhelm, anxiety, apprehension","Leading to: decreased motivation, lower productivity, reduced employee retention","Creates perception of being: overwhelmed, unmotivated, unreliable",Mental & emotional,"anxiety, overwhelm, motivation issues, well-being","stress management, wellness programs, professional counselling, support networks"
Workspace Organisation,Challenges in arranging items efficiently within a workspace.,I struggle to organise my workspace efficiently.,Difficulty in efficiently organising workspace items and tools.,"Feeling: frustration, overwhelm, stress","Leading to: inefficiency, increased errors, reduced productivity","Creates perception of being: disorganised, inattentive, inefficient","Physical, Technology","workspace organisation, inefficiency, task management difficulties, clutter management","organisational tools, workflow automation, ergonomic adjustments, task management"
Arthritis,Managing arthritis symptoms affecting work performance.,My arthritis makes it difficult to perform tasks.,Arthritis symptoms causing discomfort and limiting task performance.,"Feeling: pain, frustration, exhaustion","Leading to: decreased productivity, increased absenteeism, higher operational costs","Creates perception of being: unreliable, slow, inefficient",Physical,"chronic illness, chronic pain, physical barriers, discomfort at work","ergonomic adjustments, assistive technology, flexible schedules, physical conditioning"
Ataxia,Coping with the effects of ataxia in a work environment.,My ataxia affects my coordination at work.,Ataxia impacting physical coordination and task execution.,"Feeling: frustration, helplessness, insecurity","Leading to: increased errors, decreased productivity, higher operational costs","Creates perception of being: unreliable, inconsistent, inefficient",Physical,"chronic illness, mobility challenges, physical barriers, task execution errors","assistive technology, ergonomic adjustments, support networks, flexible schedules"
ADHD,Managing symptoms of ADHD in a professional setting.,My ADHD makes it hard to stay focused and organised.,ADHD symptoms causing difficulties with focus and organisation.,"Feeling: frustration, overwhelm, stress","Leading to: decreased productivity, increased errors, higher turnover rates","Creates perception of being: distracted, disorganised, unreliable","Mental & emotional, Sensory & focus","ADHD, attention issues, task management difficulties, performance issues","cognitive support, organisational tools, daily planning, professional counselling"
Concentration Challenges,Difficulty maintaining attentiveness and concentration at work.,I struggle to concentrate on tasks for long periods.,Difficulty maintaining focus and attentiveness during tasks.,"Feeling: frustration, stress, overwhelm","Leading to: decreased productivity, increased errors, poor decision making","Creates perception of being: distracted, inconsistent, inattentive",Sensory & focus,"attention issues, performance issues, cognitive challenges, stress","cognitive support, task management, time management, stress management"
Auditory Discrimination,Difficulty distinguishing between different sounds in the workplace.,I find it hard to distinguish sounds around me.,"Struggling to differentiate sounds, affecting communication and focus.","Feeling: confusion, frustration, stress","Leading to: increased errors, poor communication, decreased productivity","Creates perception of being: distracted, inattentive, inefficient",Sensory & focus,"auditory processing, communication barriers, sensory challenges, performance issues","assistive technology, noise management, clear communication, environmental modifications"
Auditory Processing Disorder,Auditory processing difficulties affecting work performance.,I have trouble processing what I hear at work.,"Difficulty processing auditory information, impacting performance.","Feeling: confusion, frustration, stress","Leading to: increased errors, poor communication, decreased productivity","Creates perception of being: inattentive, inconsistent, inefficient",Sensory & focus,"auditory processing, sensory challenges, communication barriers, performance issues","assistive technology, cognitive support, clear communication, environmental modifications"
Auditory Sequencing,Struggling with the order of sounds affecting task execution.,I have trouble with the sequence of sounds.,Difficulty with auditory sequencing impacting task performance.,"Feeling: frustration, confusion, stress","Leading to: increased errors, inefficiency, decreased productivity","Creates perception of being: inconsistent, inefficient, inattentive",Sensory & focus,"auditory processing, cognitive challenges, task execution errors, performance issues","cognitive support, assistive technology, task management, environmental modifications"
Autism Spectrum,Navigating the workplace as an individual on the autism spectrum.,"Being on the autism spectrum, I face unique challenges at work.",Autism spectrum disorder affecting social interactions and task management.,"Feeling: stress, anxiety, overwhelm","Leading to: decreased productivity, increased conflict, lower employee engagement","Creates perception of being: detached, disengaged, unapproachable","Mental & emotional, Sensory & focus, Social & communication","autism, social difficulties, sensory challenges, task management difficulties","neurodiversity inclusion, clear communication, support networks, flexible schedules"
Social Avoidance,Avoiding social situations at work due to anxiety.,I avoid social situations because they make me anxious.,Anxiety leading to avoidance of social interactions at work.,"Feeling: anxiety, isolation, apprehension","Leading to: decreased collaboration, lower employee engagement, increased conflict","Creates perception of being: aloof, detached, unapproachable",Social & communication,"social anxiety, anxiety, isolation, communication barriers","emotional support, stress management, clear communication, team-building"
Back Impairment,Managing work tasks with a back impairment.,My back impairment limits my ability to perform tasks.,Back impairment causing pain and limiting task performance.,"Feeling: pain, frustration, exhaustion","Leading to: decreased productivity, increased absenteeism, higher operational costs","Creates perception of being: unreliable, slow, inefficient",Physical,"chronic pain, physical barriers, mobility challenges, discomfort at work","ergonomic adjustments, assistive technology, flexible schedules, physical conditioning"
Speech Impairment,Navigating work with a speech impairment.,My speech impairment makes communication difficult.,Speech impairment affecting verbal communication at work.,"Feeling: frustration, embarrassment, isolation","Leading to: poor communication, decreased collaboration, lower employee engagement","Creates perception of being: aloof, unapproachable, detached",Social & communication,"communication barriers, speech impairment, isolation, performance issues","alternative communication, assistive technology, emotional support, clear communication"
Background Activity,Background activity causing distraction.,Background activity at work distracts me easily.,Difficulty concentrating due to distracting background activity.,"Feeling: frustration, stress, distraction","Leading to: decreased productivity, increased errors, poor decision making","Creates perception of being: distracted, inefficient, inattentive",Sensory & focus,"noise distraction, sensory challenges, attention issues, performance issues","noise management, cognitive support, stress management, environmental modifications"
Distraction from Background,Background activity that is distracting.,Background noise disrupts my focus constantly.,Background noise and activity causing constant distractions.,"Feeling: frustration, stress, distraction","Leading to: decreased productivity, increased errors, poor decision making","Creates perception of being: distracted, inefficient, inattentive",Sensory & focus,"noise distraction, sensory challenges, attention issues, performance issues","noise management, cognitive support, stress management, environmental modifications"
Caregiving and Career,Balancing caregiving responsibilities with career aspirations.,Balancing caregiving with my career is incredibly challenging.,Managing caregiving duties while pursuing career goals.,"Feeling: overwhelm, stress, exhaustion","Leading to: increased absenteeism, decreased productivity, lower employee engagement","Creates perception of being: overwhelmed, distracted, unreliable",Life,"work-life balance, stress, caregiving responsibilities, burnout","flexible schedules, support networks, wellness programs, time management"
Caregiving and Work Relationships,Balancing caregiving responsibilities with work relationships.,Caregiving affects my work relationships significantly.,Juggling caregiving duties while maintaining work relationships.,"Feeling: stress, overwhelm, apprehension","Leading to: decreased collaboration, higher absenteeism, increased conflict","Creates perception of being: unreliable, disengaged, overwhelmed","Life, Social & communication","work-life balance, stress, caregiving responsibilities, peer relations","flexible schedules, support networks, wellness programs, team-building"
